,instrument_id,Name,Title,Pay,Exercised,year_born,data_vendor_id,refreshed_at
0,238,Mr. Tony G. Bowen,Chief Financial Officer,779.22k,0.0,1975,2,2018-07-03 01:07:28
1,238,Mr. Thomas A. Gerke,Chief Admin. Officer & Gen. Counsel,1.1M,0.0,1956,2,2018-07-03 01:07:28
2,238,Ms. Kathryn M. Collins,Sr. VP & Strategy Officer,641.97k,0.0,1964,2,2018-07-03 01:07:28
3,238,Mr. Jeffrey J. Jones II,CEO & Pres,0,0.0,1968,2,2018-07-03 01:07:28
4,238,Mr. Henry W. Bloch,Co-Founder & Honorary Chairman,0,0.0,1922,2,2018-07-03 01:07:28
