,instrument_id,Name,Title,Pay,Exercised,year_born,data_vendor_id,refreshed_at
0,372,Dr. Thomas A. Kennedy,Chairman &CEO,4.66M,0.0,1956,2,2018-07-03 01:57:57
1,372,Mr. Anthony F. O'Brien,VP & CFO,1.43M,0.0,1965,2,2018-07-03 01:57:57
2,372,Mr. David C. Wajsgras,"VP and Pres of Intelligence, Information & Services Bus. Unit",2.22M,0.0,1960,2,2018-07-03 01:57:57
3,372,Dr. Taylor W. Lawrence,VP & Pres of the Missiles Systems Bus. Unit,1.66M,0.0,1964,2,2018-07-03 01:57:57
4,372,Mr. Richard R. Yuse,VP and Pres of the Space & Airborne Systems Bus. Unit,2.24M,0.0,1952,2,2018-07-03 01:57:57
