,instrument_id,Name,Title,Pay,Exercised,year_born,data_vendor_id,refreshed_at
0,430,Mr. D. James Bidzos,"Founder, Exec. Chairman, Pres & CEO",2.22M,0.0,1955.0,2,2018-07-03 02:19:49
1,430,Mr. George E. Kilguss III,Exec. VP & CFO,985.62k,0.0,1961.0,2,2018-07-03 02:19:49
2,430,Mr. Todd B. Strubbe,Exec. VP & COO,1.19M,0.0,1963.0,2,2018-07-03 02:19:49
3,430,Mr. Thomas C. Indelicarto,"Exec. VP, Gen. Counsel & Sec.",899.06k,0.0,1964.0,2,2018-07-03 02:19:49
4,430,Dr. Burt Kaliski Jr.,Sr. VP & CTO,0,0.0,0.0,2,2018-07-03 02:19:49
