,instrument_id,Name,Title,Pay,Exercised,year_born,data_vendor_id,refreshed_at
0,105,Mr. Gregory Eugene Johnson CPA,Chairman & CEO,0,0.0,1961,2,2018-07-03 00:17:53
1,105,Ms. Jennifer M. Johnson,Pres & COO,0,0.0,1964,2,2018-07-03 00:17:53
2,105,Mr. Kenneth Allan Lewis,"Exec. VP, CFO & Principal Accounting Officer",0,0.0,1961,2,2018-07-03 00:17:53
3,105,Mr. Alok Sethi,Exec. VP of Technology & Operations,0,0.0,1961,2,2018-07-03 00:17:53
4,105,Mr. Craig Steven Tyle,Exec. VP & Gen. Counsel,1.17M,0.0,1960,2,2018-07-03 00:17:53
