,instrument_id,Name,Title,Pay,Exercised,year_born,data_vendor_id,refreshed_at
0,498,Mr. Frank J. Del Rio,"Pres, CEO & Director",1.76M,0.0,1955,2,2018-07-03 02:45:12
1,498,Mr. T. Robin Lindsay,Exec. VP of Vessel Operations,942.51k,0.0,1958,2,2018-07-03 02:45:12
2,498,Mr. Andrew C. Stuart,Pres & CEO of Norwegian brand,696.01k,0.0,1963,2,2018-07-03 02:45:12
3,498,Mr. Jason M. Montague,Pres & CEO of Regent brand,0,0.0,1974,2,2018-07-03 02:45:12
4,498,Ms. Wendy A. Beck,Exec. Officer,690.7k,0.0,1964,2,2018-07-03 02:45:12
