,instrument_id,Name,Title,Pay,Exercised,year_born,data_vendor_id,refreshed_at
0,415,Mr. Stephen J. Hemsley,Exec. Chairman,6.35M,10.78M,1953,2,2018-07-03 02:14:06
1,415,Mr. David Scott Wichmann,CEO & Director,5.72M,10.96M,1963,2,2018-07-03 02:14:06
2,415,Mr. John F. Rex,Exec. VP & CFO,2.18M,0,1962,2,2018-07-03 02:14:06
3,415,Ms. Marianne D. Short,Exec. VP & Chief Legal Officer,2.7M,0,1952,2,2018-07-03 02:14:06
4,415,Mr. Steven Hale Nelson,Exec. VP & CEO of Unitedhealthcare,0,0,1959,2,2018-07-03 02:14:06
