,instrument_id,Name,Title,Pay,Exercised,year_born,data_vendor_id,refreshed_at
0,549,Mr. Kenneth J. Giacobbe,"Chief Financial Officer, Exec. VP and Member of Exec. Council",1.1M,0.0,1966.0,2,2018-07-03 03:04:09
1,549,Ms. Katherine Hargrove Ramundo,"Exec. VP, Chief Legal Officer, Sec. & Member of Exec. Council",0,0.0,1968.0,2,2018-07-03 03:04:09
2,549,Mr. Timothy Donald Myers,Exec. VP & Member of Exec. Council,0,0.0,1966.0,2,2018-07-03 03:04:09
3,549,Mr. Eric V. Roegner,"Former EVP, Member of Exec. Council and Group Pres of Engineered Products & Solutions",0,0.0,1970.0,2,2018-07-03 03:04:09
4,549,Mr. Charles P. Blankenship Jr.,CEO & Director,0,0.0,0.0,2,2018-07-03 03:04:09
