,instrument_id,Name,Title,Pay,Exercised,year_born,data_vendor_id,refreshed_at
0,545,Mr. John J. Haley,CEO & Exec. Director,3.55M,0.0,1950,2,2018-07-03 03:02:42
1,545,Mr. Michael J. Burwell CPA,Chief Financial Officer,0,0.0,1964,2,2018-07-03 03:02:42
2,545,Mr. Todd J. Jones,Head of Corp. Risk & Broking,1.94M,0.0,1965,2,2018-07-03 03:02:42
3,545,Ms. Julie Jarecke Gebauer,Head of Human Capital & Benefits,0,0.0,1961,2,2018-07-03 03:02:42
4,545,Mr. Gene H. Wickes,Head of Benefits Delivery & Admin.,1.46M,0.0,1952,2,2018-07-03 03:02:42
