,instrument_id,Name,Title,Pay,Exercised,year_born,data_vendor_id,refreshed_at
0,141,Mr. N. Thomas Linebarger,Chairman & CEO,4.57M,0,1963,2,2018-07-03 00:31:19
1,141,Mr. Richard J. Freeland,"Pres, COO & Director",2.02M,0,1957,2,2018-07-03 00:31:19
2,141,Mr. Patrick J. Ward,VP & CFO,1.64M,0,1964,2,2018-07-03 00:31:19
3,141,Ms. Marya M. Rose,VP & Chief Admin. Officer,1.35M,429.87k,1963,2,2018-07-03 00:31:19
4,141,Mr. Livingston L. Satterthwaite,VP & Pres of Distribution Bus.,1.31M,0,1961,2,2018-07-03 00:31:19
