,instrument_id,Name,Title,Pay,Exercised,year_born,data_vendor_id,refreshed_at
0,145,Mr. James M. Foote,"Pres, CEO & Director",0,0.0,1954.0,2,2018-07-03 00:32:47
1,145,Mr. Frank A. Lonegro,Exec. VP & CFO,1.18M,0.0,1969.0,2,2018-07-03 00:32:47
2,145,Ms. Sarah Kathleen Brandt,Sr. VP & Chief Information Officer,0,0.0,1964.0,2,2018-07-03 00:32:47
3,145,Mr. Mark K. Wallace,Exec. VP & Chief Admin. Officer,0,0.0,1970.0,2,2018-07-03 00:32:47
4,145,Mr. Peter J. Shudtz,VP of Federal Regulation,0,0.0,0.0,2,2018-07-03 00:32:47
